{
  "contract_version": 1,
  "job_id": "11111111-1111-4111-8111-111111111111",
  "run_id": "22222222-2222-4222-8222-222222222222",
  "attempt_id": "33333333-3333-4333-8333-333333333333",
  "document_type": "receipt",
  "schema_version": "receipt.v1",
  "language": "vi",
  "input_sha256": "0000000000000000000000000000000000000000000000000000000000000000",
  "pipeline_manifest_id": "fixture_pipeline.v1",
  "remaining_budget_ms": 120000
}
